分類,書名,圖片網址,作者,出版社,出版日期,優惠價,內容,商品連結,也買了
語言學習,一次學會基礎越南語：透過本書所教授最簡單、最常用的語句，立刻就能講出越南人天天在用的生活越南語（附全書音檔下載QR碼）,https://www.books.com.tw/img/001/092/19/0010921974.jpg,尹善愛,國際學村,2022/04/28,優惠價：79折 299元,"《給初學者的第一堂越南語會話課》修訂版
本書從字母、發音、聲調教起！
絕對可以從零開始，並學會一般日常生活對話
一次學會基礎越語！
只要3步驟！
從單字變短句、從短句變完整句子
讓你可以舉一反三...more",https://www.books.com.tw/products/0010921974?loc=P_0005_053,"['我的第一本越南語發音：一次弄懂越南語複雜的母音、子音、尾音、聲調無負擔(附1 MP3)', '一本搞定!生活越南語脫口說(1書1MP3)', '[星巴克]松露海鹽星格脆', '速學越南語：零基礎自學、教學都適用!只要14堂課，輕鬆聽說讀寫越南語 (掃描 QR code收聽書中越南語內容)', '套公式學越南語!生活.旅遊.經商會話速成(隨書附作者親錄標準越南語朗讀音檔QR Code)']"
語言學習,日本人的哈啦妙招！日文擬聲‧擬態語輕鬆學：附MP3音檔QR Code,https://www.books.com.tw/img/001/092/21/0010922173.jpg,山本峰規子,笛藤,2022/04/27,優惠價：9折 261元,"本書整理出500多個日語中最常用到的擬聲、擬態語，
讓你的日文生動又活潑！
大家以前國文課一定都學過中文中的狀聲詞和狀態詞，例如「風聲颯颯」、「肚子餓得咕嚕咕嚕」、「亮晶晶」、「圓滾滾」等等...more",https://www.books.com.tw/products/0010922173?loc=P_0005_054,"['峰與谷：超越逆境、享受順境的人生禮物', 'JLPT新日檢 N3一本合格【博客來獨家贈第四回紙本模擬試題】(附單字句型記憶小冊音檔MP3+模擬試題暨詳解4回)', '大家的日本語 初級Ⅰ改訂版 文法解說・參考詞彙・課文中譯', '走出迷宮：尋找人生新乳酪。全球熱賣2800萬冊經典寓言《誰搬走了我的乳酪?》全新續集!', '和菓子物語：Nippon所藏日語嚴選講座 (1書1雲端MP3音檔)', 'Lishan北海道馬油保濕潤膚霜─櫻花香(限定版)200g', '大家的日本語初級I改訂版 練習ABC.問題解答(附中譯)', '60字法則商用日語文章術', '大家的日本語 初級Ⅰ 改訂版']"
語言學習,全方面破解英文多益單字：高分單字X關鍵搭配詞X萬用例句的必勝三「步」曲,https://www.books.com.tw/img/001/092/25/0010922518.jpg,張慈庭英語教學團隊,資料夾文化出版事業有限公司,2022/05/05,優惠價：79折 395元,"為什麼記憶單字萬千，卻仍然無法突破多益考試？
你需要的是掌握高分關鍵！
17個單元分門別類聯想單字，
有效積累單字的同時，延伸學習常見慣用語，
搭配音檔同步訓練聽力，
讓你輕鬆攻克生活化新制考題！...more",https://www.books.com.tw/products/0010922518?loc=P_0005_055,['NaN']
語言學習,AMIGO西班牙語A2（隨書附國際標準西語朗讀音檔QR Code）,https://www.books.com.tw/img/001/092/13/0010921390.jpg,José Gerardo Li Chan,瑞蘭國際,2022/04/21,優惠價：9折 495元,"最受西語學習者歡迎的《AMIGO西班牙語A1》，
堂堂推出第二冊《AMIGO西班牙語A2》！
學完西語A1程度，想更進一步提升西語能力到A2程度，
用這本最有野心、可以最快上手的《AMIGO西班牙語A2》就對了！
...more",https://www.books.com.tw/products/0010921390?loc=P_0005_056,"['AMIGO西班牙語A1(隨書附作者親錄國際標準西語發音+朗讀音檔QR Code)', '我的第一本西班牙語文法：完全表格化呈現，一看就懂的西語文法入門書(附MP3)', '我的第四堂西語課(隨書附作者親錄標準西語朗讀音檔QR Code)']"
語言學習,實境英文練聽力：跟著做，聽＆說同步進化！（MP3音檔 + 加值學更多線上下載）,https://www.books.com.tw/img/001/092/21/0010922162.jpg,劉怡均,貝塔,2022/05/03,優惠價：79折 379元,"想搞懂老外說什麼，千萬不能光聽不練！
跟著本書從最貼近生活的實用情境開始
反覆聽>>口跟讀>>動手寫
徹底突破連音、變音、弱讀、重音、語調等發音變化難點
情境聽解、口語表達一起升級！
   
...more",https://www.books.com.tw/products/0010922162?loc=P_0005_057,"['[MUJI無印良品]即食迷你拉麵 (雞汁風味)/120g', '[MUJI 無印良品]棉棒(補充用)/200支']"
語言學習,小王子（臺法對照版）,https://www.books.com.tw/img/001/092/32/0010923211.jpg,Antoine de Saint-Exupéry,白象文化,2022/05/01,優惠價：9折 405元,"臺文、法文對照版本，加上原作者的手繪插圖，帶您進入小王子、玫瑰與狐狸的奇幻世界！
◎所有的大人一開始攏是囝仔，讓我們藉由重讀《小王子》，回到純真年代！
◎本書由《小王子》法文修訂版直接...more",https://www.books.com.tw/products/0010923211?loc=P_0005_058,['Frank Martin：Concertos for 7 Wind Instruments/Passacaglia/Violin Concert， etc.']
語言學習,英文閱讀素養訓練課：經典文學故事 （16K+寂天雲隨身聽APP）,https://www.books.com.tw/img/001/092/44/0010924407.jpg,"Michael A. Putlack,e-Creative Contents",寂天,2022/05/13,優惠價：9折 405元,"108課綱閱讀素養培植書！
以名著閱讀法，打造閱讀原文書的實力
不用頻查字典就能品嚐最原味的感動
 
《英文閱讀素養訓練課》套書共分《童話寓言故事》及《經典文學故事》兩冊，由易至難共有六個學...more",https://www.books.com.tw/products/0010924407?loc=P_0005_059,['英文閱讀素養訓練課：童話寓言故事(16K+寂天雲隨身聽APP)']
語言學習,辦公室英語會話必勝課：職場溝通即戰力（20K+寂天雲隨身聽APP）,https://www.books.com.tw/img/001/092/23/0010922358.jpg,Michelle Witte,寂天,2022/04/18,優惠價：9折 468元,"最多元的職場情境、最豐富的辦公室英語會話實例！
高效提升職場英語會話能力，展現專業自信，
外商族、晉升、加薪、外派必備！
增強多益聽力口說應考實力，
打造最強辦公室英語溝通即...more",https://www.books.com.tw/products/0010922358?loc=P_0005_060,"['商務英語溝通力UP：職場必學情境會話課(20K+寂天雲隨身聽APP)', '100+ 句學校沒教的英文慣用語：秒讚口說考官高分表達，躍升母語程度 English Speaker (附QR Code 線上跟讀音檔)', '上班族天天說美語：職場美語萬用手冊(附MP3)']"
語言學習,生活美語帶著走：實境模擬＋精準短句＋學習關鍵細節，練出自然流暢英語力（隨掃即聽QR Code實境對話＋核心詞彙全收錄）,https://www.books.com.tw/img/001/092/27/0010922781.jpg,Tong Weng,凱信企管,2022/05/04,優惠價：79折 276元,"別擔心字彙不夠用、不怕會話不敢說，
高實用度主題＋精準短語，
這一次保證程度三級跳，開口流利說英語！
保證POINT1.生活實境會話＋精準短句
收錄生活場景細節及老外常說會話短語，即學即用、...more",https://www.books.com.tw/products/0010922781?loc=P_0005_061,"['德國 好立善 鎂發泡錠(20錠) (幫助入睡)柑橘口味', '可以馬上和老外聊不停的英語會話： 寫給學過多年英文，還是不敢開口說英文的人 (附MP3)']"
語言學習,英語聽力有救了：基礎篇【全新修訂版】書+電腦互動學習軟體(含朗讀MP3)＋別冊,https://www.books.com.tw/img/001/092/43/0010924334.jpg,LiveABC編輯群,希伯崙,2022/04/25,優惠價：9折 468元,"適用程度全民英檢初級以上、CEFRA2-B1等級、新多益350分以上
還在埋頭苦做考題？多元化的練習更重要！
這是一本幫你快速提升英聽成績的必備寶典！
紮實英語聽力訓練滿足各種考試需...more",https://www.books.com.tw/products/0010924334?loc=P_0005_062,"['CNN主播為你開的英語聽力課【1書+ 1片DVD─ROM電腦互動光碟(含課文朗讀MP3)+別冊】', '朗文英語越聽越清楚1 聽力滿分練習(單書/MP3另售)', '唱吧!英文歌謠：聽歌謠說故事【二版】(25K軟精裝+144首歌謠MP3)', 'CNN主播教你 一字一句聽懂新聞英語【書+電腦互動學習軟體(含朗讀MP3)】', '專攻聽力：英語聽力滿分單字(附MP3)']"
語言學習,Cambridge YLE A1 Movers模擬試題 1 (附隨掃隨聽QR CODE音檔),https://www.books.com.tw/img/001/092/63/0010926392.jpg,師德出版部,師德文教,2022/06/03,優惠價：79折 166元,YLEA1Movers模擬試題完全依據2018年新制試題的題型所設計，提供一回完整的模擬測驗，涵蓋聽、讀、寫、說四大面向。解答與聽力稿另外裝訂成冊，便於教師使用及檢討答案。利用手機或平板掃描音檔QR...more,https://www.books.com.tw/products/0010926392?loc=P_0005_063,['Cambridge YLE A1 Movers模擬試題 2 (附隨掃隨聽QR CODE音檔)']
語言學習,Cambridge YLE A1 Movers模擬試題 2 (附隨掃隨聽QR CODE音檔),https://www.books.com.tw/img/001/092/63/0010926393.jpg,師德出版部,師德文教,2022/06/03,優惠價：79折 166元,YLEA1Movers模擬試題完全依據2018年新制試題的題型所設計，提供一回完整的模擬測驗，涵蓋聽、讀、寫、說四大面向。解答與聽力稿另外裝訂成冊，便於教師使用及檢討答案。利用手機或平板掃描音檔QR...more,https://www.books.com.tw/products/0010926393?loc=P_0005_064,['Cambridge YLE A1 Movers模擬試題 1 (附隨掃隨聽QR CODE音檔)']
語言學習,朗讀QR碼 精修關鍵字版 新制對應 絕對合格 日檢必背文法N1：附三回模擬試題（25K+附QR碼線上音檔+實戰MP3）,https://www.books.com.tw/img/001/092/19/0010921952.jpg,"吉松由美,田中陽子,山田社日檢題庫小組",山田社,2022/05/06,優惠價：79折 315元,"為因應眾多讀者及學校的熱烈要求，
《精修關鍵字版新制對應絕對合格！日檢必背文法N1》隆重推出「QR碼線上音檔+MP3版」了。
除了可以聆聽附贈的「實戰MP3」音檔之外，
還可以手機隨掃即聽QR碼行動學習...more",https://www.books.com.tw/products/0010921952?loc=P_0005_065,"['JLPT新日檢【N1文法】考前衝刺大作戰', '日本語能力試驗 耳感記憶 文法N1']"
語言學習,日檢N2全方位攻略解析【雙書裝：文字語彙本＋文法讀解聽解本，附1回完整模擬題】（16K+寂天雲隨身聽APP）,https://www.books.com.tw/img/001/092/20/0010922057.jpg,金男注,寂天,2022/04/26,優惠價：9折 675元,"搞懂每個出題單元，短期通過Ｎ2！
本書專為想在短時間內通過日檢N2的考生所設計，徹底分析近幾年出題趨勢，列出各大重點題型，並提供內容豐富的實戰擬真題目。只要認真讀完本書，就能達成合格目...more",https://www.books.com.tw/products/0010922057?loc=P_0005_066,['NaN']
語言學習,讀客家俗諺•學客語字音字形,https://www.books.com.tw/img/001/092/38/0010923872.jpg,"鄭明中,張月珍",五南,2022/04/25,優惠價：95折 551元,客語長期受到國語及閩南語強勢影響而日漸瀕危，教育部與客家委員會為傳承與發展客語，其中統一客語字音字形更是客語傳承與發展的重點環節，也是「全國語文競賽」及「客語能力中級暨中高級認證」的重點...more,https://www.books.com.tw/products/0010923872?loc=P_0005_067,"['大家來學客家話(書附MP3)', '客語詞庫─客語音標版(精)', '客家生趣話1000則：先人的智慧.俚諺語說話趣', '香港客家話研究', '大學初級客語(隨書附聽力QR Code)']"
語言學習,5分鐘征服英文法：圖表解說 清楚好記（附MP3）,https://www.books.com.tw/img/001/092/39/0010923905.jpg,張瑪麗,哈福企業,2022/05/18,優惠價：79折 269元,"追求卓越的英語
5分鐘流利脫口說
心智圖學習法
一目瞭然
學得快、記得牢
英語贏在每天5分鐘
GoodEnglishin5min.
◆5分鐘學好英語的秘訣
記得，英語是一種語言，
你是要用英語來跟別人溝...more",https://www.books.com.tw/products/0010923905?loc=P_0005_068,"['睡前5分鐘的多益文法課(免費附贈虛擬點讀筆App)', '旋元佑文法解題', '賴氏英文文法(附1MP3)', '搭配詞的力量Collocations：名詞篇 全新升級版(隨書附贈美籍專業錄音員親錄標準美式英語朗讀MP3)', '搭配詞的力量Collocations：形容詞篇(隨書附贈美籍專業錄音員親錄標準美式英語朗讀MP3)']"
語言學習,絕對合格 全攻略！新制日檢N4必背必出聽力（25K＋QR碼線上音檔＋MP3）,https://www.books.com.tw/img/001/092/42/0010924283.jpg,"吉松由美,西村惠子,田中陽子,山田社日檢題庫小組",山田社,2022/06/09,優惠價：79折 276元,"愛因斯坦說：
「人的差異就在業餘時間，業餘時間生產著人才。」
 
從現在開始，每天日語進步一點點，
可別小看日復一日的微小累積，它可以水滴石穿，讓您從N5到N1都一次考上。
多懂一種語言，...more",https://www.books.com.tw/products/0010924283?loc=P_0005_069,"['快樂聽學新聞日語3(附mp3 CD)', '新聞日本語 聽解50(附MP3 CD1片)', '聽到哪學到哪：在日本聽廣播學日語(新版)附臨場感MP3', '日語聽解入門練習(上冊)', '精修版 新制對應 絕對合格!日檢必背聽力N4(25K+MP3)']"
語言學習,新托福100+iBT寫作（附QR Code音檔）,https://www.books.com.tw/img/001/092/53/0010925381.jpg,"韋爾,倍斯特編輯部",倍斯特出版事業有限公司,2022/05/30,優惠價：79折 363元,"【獨立篇】
搶先讀獨立篇範文，協助考生迅速拆解棘手話題，累積各式「長難句」語庫，優化個人表達、呈現的論點獨特、具體、具說服力！
 
★獨家「段落拓展」規劃
協助考生有邏輯且快速...more",https://www.books.com.tw/products/0010925381?loc=P_0005_070,['【檔案家】A4 11孔2格大紅包袋珍藏內頁20入']
語言學習,JLPT新日檢【N5字彙】考前衝刺大作戰,https://www.books.com.tw/img/001/092/55/0010925552.jpg,"費長琳,黃均亭",捷徑文化,2022/06/01,優惠價：79折 198元,"日文字彙量如此龐雜，讓你不知道要從何下手嗎？
本書精選真正會考的單字，
搭配精選例句+外師錄音，讓你輕鬆備考一試合格！
 
■備考時間分秒必爭，讓精選N5單字成為滿分關鍵
單字的運用不限...more",https://www.books.com.tw/products/0010925552?loc=P_0005_071,['JLPT新日檢【N4字彙】考前衝刺大作戰']
語言學習,新日檢N3言語知識（文字‧語彙‧文法）全攻略 QR Code版（隨書附日籍名師親錄標準日語朗讀音檔QR Code）,https://www.books.com.tw/img/001/092/13/0010921394.jpg,余秋菊,瑞蘭國際,2022/04/21,優惠價：9折 342元,"眾多讀者的需求及反饋，我們聽到了！
熱銷上萬本！日檢應考者有口皆碑！
配合考題趨勢、掌握必考單字、最精準有效的《新日檢N3言語知識全攻略》，
堂堂推出QRCode版，
隨掃即聽，隨時隨地備考，保證高分...more",https://www.books.com.tw/products/0010921394?loc=P_0005_072,['新日檢N3模擬試題+完全解析 QR Code版(隨書附日籍名師親錄標準日語聽解試題音檔QR Code)']
語言學習,超高命中率 新制對應 絕對合格！日檢[單字、聽力] N4（25K+附QR Code線上音檔＆實戰MP3）,https://www.books.com.tw/img/001/092/19/0010921954.jpg,"吉松由美,田中陽子,西村惠子,千田晴夫,大山和佳子,山田社日檢題庫小組",山田社,2022/05/06,優惠價：79折 410元,"為因應學習方式的改變，研發「數位耳朵」學習，
只要掃描書本上的QRCode，
就能完全掌握「捷進」的「分類單字＆聽力」，
只要有收機訊號，可隨時隨地在任何地方學習了。
《絕對合格！新制日檢...more",https://www.books.com.tw/products/0010921954?loc=P_0005_073,"['修訂版 合格全攻略!新日檢6回全真模擬試題N1【讀解.聽力.言語知識〈文字.語彙.文法〉】(16K+6回聽解MP3)', '修訂版 合格全攻略!新日檢6回全真模擬試題N5【讀解.聽力.言語知識〈文字.語彙.文法〉】(16K+6回聽解MP3)', '新日檢JLPT N4 N5關鍵單字2，500：主考官的單字庫完全收錄，新日檢N4 N5快速過關!(附1主考官一定會考的單字隨身冊+1CD+虛擬點讀筆APP)', '新日檢完勝對策N2：聽解(MP3免費下載)', '精修關鍵句版 新制對應絕對合格!日檢必背閱讀N1(25K)']"
語言學習,絕對合格 全攻略！新制日檢N2必背必出聽力（25K＋QR碼線上音檔＋MP3）,https://www.books.com.tw/img/001/092/42/0010924280.jpg,"吉松由美,田中陽子,西村惠子,山田社日檢題庫小組",山田社,2022/06/09,優惠價：79折 292元,"愛因斯坦說：
「人的差異就在業餘時間，業餘時間生產著人才。」
 
從現在開始，每天日語進步一點點，
可別小看日復一日的微小累積，它可以水滴石穿，讓您從N5到N1都一次考上。
多懂一種語言，...more",https://www.books.com.tw/products/0010924280?loc=P_0005_074,['絕對合格 全攻略!新制日檢N2必背必出閱讀(25K)']
語言學習,40天搞定新日檢N3單字（隨書附作者親錄標準日語朗讀音檔QR Code）,https://www.books.com.tw/img/001/092/42/0010924299.jpg,こんどうともこ,瑞蘭國際,2022/05/23,優惠價：79折 300元,"只要40天！
 
本書精選新日檢N3的必考單字，每個單字皆有符合N3程度文法及單字的例句，加上與該單字相似、相反、延伸學習的其他單字，
 
讓您在記憶單字的同時，能加深印象、舉一反三，還...more",https://www.books.com.tw/products/0010924299?loc=P_0005_075,['NaN']
語言學習,華語文書寫能力習字本：中越語版基礎級1（依國教院三等七級分類，含越語釋意及筆順練習）,https://www.books.com.tw/img/001/092/45/0010924529.jpg,療癒人心悅讀社,朱雀,2022/05/13,優惠價：9折 107元,本書依「國家教育研究院」建置之臺灣華語文能力基準（TBCL）包括：聽、說、讀、寫、譯，三等七級能力指標為基礎，其中「寫」之部分最為困難，因此本書特別將每個字附上漢語/漢南字拼音、越語解釋及完...more,https://www.books.com.tw/products/0010924529?loc=P_0005_076,"['華語文書寫能力習字本：中越語版基礎級2(依國教院三等七級分類，含越語釋意及筆順練習)', '華語文書寫能力習字本：中越語版基礎級3(依國教院三等七級分類，含越語釋意及筆順練習)']"
語言學習,IELTS 雅思致勝寶典：圖解聽說讀寫攻略+ 4回完勝     模擬試題-試題本+解析本+ QR Code線上音檔,https://www.books.com.tw/img/001/092/51/0010925141.jpg,"Andrew Betsis,Lawrence Mamas,賴世雄",常春藤,2022/05/26,優惠價：9折 567元,"超強圖解攻略+專業仿真試題+精準完美解析=雅思必得高分
聽、說、讀、寫一次滿足 迎戰雅思，關鍵必勝
常春藤最強編輯團隊X英國權威英檢出版社GlobalELT聯手出擊
本書適用「學術組...more",https://www.books.com.tw/products/0010925141?loc=P_0005_077,['NaN']
語言學習,IELTS 雅思致勝寶典：圖解聽說讀寫攻略+ 3回制霸     模擬試題-試題本+解析本+ QR Code線上音檔,https://www.books.com.tw/img/001/092/51/0010925143.jpg,"Andrew Betsis,Lawrence Mamas,賴世雄",常春藤,2022/05/26,優惠價：9折 449元,"超強圖解攻略+專業仿真試題+精準完美解析=雅思必得高分
聽、說、讀、寫一次滿足 迎戰雅思，關鍵必勝
常春藤最強編輯團隊X英國權威英檢出版社GlobalELT聯手出擊
本書適用「學術組...more",https://www.books.com.tw/products/0010925143?loc=P_0005_078,"['IELTS 雅思致勝寶典：圖解聽說讀寫攻略+ 4回完勝 模擬試題─試題本+解析本+ QR Code線上音檔', 'IELTS 雅思致勝寶典：圖解聽說讀寫攻略+ 4回奪標 模擬試題─試題本+解析本+ QR Code線上音檔', '潛富：成為真正富人的潛意識關鍵【潛意識大師經典致富法則】']"
語言學習,IELTS 雅思致勝寶典：圖解聽說讀寫攻略+ 4回奪標 模擬試題-試題本+解析本+ QR Code線上音檔,https://www.books.com.tw/img/001/092/51/0010925145.jpg,"Andrew Betsis,Lawrence Mamas,賴世雄",常春藤,2022/05/26,優惠價：9折 567元,"超強圖解攻略+專業仿真試題+精準完美解析=雅思必得高分
聽、說、讀、寫一次滿足 迎戰雅思，關鍵必勝
常春藤最強編輯團隊X英國權威英檢出版社GlobalELT聯手出擊
 
本書適用「...more",https://www.books.com.tw/products/0010925145?loc=P_0005_079,"['IELTS 雅思致勝寶典：圖解聽說讀寫攻略+ 3回制霸 模擬試題─試題本+解析本+ QR Code線上音檔', 'IELTS 雅思致勝寶典：圖解聽說讀寫攻略+ 4回完勝 模擬試題─試題本+解析本+ QR Code線上音檔', '雅思口說教戰手冊：從流利度與連貫性、字彙、文法到發音，讓你思考、講英文就像個母語人士(附QR Code英美雙聲發音)', '潛富：成為真正富人的潛意識關鍵【潛意識大師經典致富法則】']"
語言學習,日本語能力試驗N5文字．語彙/文法/讀解/聽解,https://www.books.com.tw/img/001/092/51/0010925196.jpg,"星野恵子,辻和子",尚昂文化,2022/05/25,優惠價：9折 270元,"◇本書的構成
【文字．語彙】
＜漢字讀法＞36題（９題×４回）
＜書寫（漢字‧片假名）＞32題（８題×４回）
＜情境表達＞30題（10題×３回）
＜替...more",https://www.books.com.tw/products/0010925196?loc=P_0005_080,"['穩紮穩打!新日本語能力試驗 文法・讀解特別篇', '新日檢完勝500題N3：文字.語彙.文法', '穩紮穩打!新日本語能力試驗 N3文法 (修訂版)', '穩紮穩打!新日本語能力試驗N2文法', '新日檢完勝500題N1：文字.語彙.文法']"
語言學習,JLPT新日檢【N4字彙】考前衝刺大作戰,https://www.books.com.tw/img/001/092/55/0010925529.jpg,"費長琳,黃均亭",捷徑文化,2022/06/01,優惠價：79折 253元,"日文字彙量如此龐雜，讓你不知道要從何下手嗎？
本書精選真正會考的單字，
搭配精選例句+外師錄音，讓你輕鬆備考一試合格！
備考時間分秒必爭，讓精選N4單字成為滿分關鍵
單字的運用不限於文字語...more",https://www.books.com.tw/products/0010925529?loc=P_0005_081,['JLPT新日檢【N5字彙】考前衝刺大作戰']
語言學習,我的第一本圖解印尼語單字：全場景 1500 張實境圖解，讓生活中的人事時地物成為你的印尼語老師！ (附QR碼線上音檔),https://www.books.com.tw/img/001/092/57/0010925746.jpg,王耀仟,國際學村,2022/06/09,優惠價：79折 569元,"第一本「實境式全圖解」印尼語單字書！
從家裡的居家生活到外面的周圍環境，最全面、最詳細！
不必再在網路上瞎子摸象，查個半天又查不到！
印尼語字典找不到！生活上所必須用到的大量用語，本書一次滿...more",https://www.books.com.tw/products/0010925746?loc=P_0005_082,"['我的第一本印尼語會話課本 ：自學、教學、旅遊、線上交流、洽商工作皆實用的在地印尼語!(附QR碼線上音檔)', '躺著背印尼語2000單字：簡易中文拼音學習，初學&自修好幫手 (附中文.印尼語朗讀MP3)', '1秒開口說：我的第一本印尼語單字(附MP3+印尼語發音記憶表)', '我的第一本越南語課本：最好學的越南語入門書(附MP3)', '我的第一本印尼語文法 ：用最科學的方法，聰明記住印尼語文法!']"
語言學習,大考英文字彙力6000隨身讀,https://www.books.com.tw/img/001/092/24/0010922445.jpg,三民英語編輯小組,三民,2022/04/27,優惠價：95折 314元,"第一本完整收錄最新字表的隨身讀！
獨家贈送「拼讀」音檔，用聽的也能背單字！
 
◆收錄最新字表完整內容！
參照108新課綱「高中英文參考詞彙表(111學年度起適用)」彙整，全面提升大考英文字...more",https://www.books.com.tw/products/0010922445?loc=P_0005_083,['進階英文字彙力4501~6000隨身讀']
語言學習,語法動起來 2,https://www.books.com.tw/img/001/092/37/0010923767.jpg,"邱新富,戴金惠,姚瑜雯,于麗萍",新學林,2022/04/28,優惠價：95折 285元,"《語法動起來2》是為從事華語教學的老師，和有志參與這項工作的讀者，所編寫的關於教案設計與方法的專書。
人類母語能力的發展從一開始就在有「語境」的情況下開始，為此，華語教師在面對初、中...more",https://www.books.com.tw/products/0010923767?loc=P_0005_084,"['看圖學中文語法：進階篇', '華語教學專用英語', '新版實用視聽華語1─附MP3 (第三版)', '對外漢語教學語法(修訂二版)', '看圖學中文語法：基礎篇']"
語言學習,與世界接軌的必勝英文課：三步驟馬上晉升全球搶手人才(附虛擬點讀筆APP+1CD),https://www.books.com.tw/img/001/092/37/0010923768.jpg,袁思嘉,不求人文化,2022/05/04,優惠價：79折 276元,"讀懂英文，就像開啓新世界的大門，
讀完這本書，就能邁向全新的世界。
只要三個步驟，馬上晉升全球搶手人才！
步驟一、理解文法概念
→搭配例句，融會貫通！
步驟二、熟悉情境會話
→時機用法，精準掌握...more",https://www.books.com.tw/products/0010923768?loc=P_0005_085,['可複製的領導力(2)：樊登的7堂管理課']
